{
  "meta": {
    "title": "重返黑色校园",
    "author": "MasterNoah",
    "ruleSystem": "coc",
    "version": "1.0"
  },
  "scenes": [
    {
      "id": "scene_001",
      "name": "预设导入",
      "description": "调查员像往常一样上班，坐在自己的位置前浏览着这个月古城市各个中学向政府提交的资助申请表。明知道这里面的绝大多数钱款最终会被某人收进自己的腰包，但是自己能做的事却只有盖下“通过”的章子并签下自己的名字，再将这些申请表交给流水线的另一名同事。突然，要盖上章子的申请表被另外一张纸挡住了。“上头让咱们部门出一个人，我看要不然就你去吧。”调查员的上司这样对他说。放在调查员桌子上的是一张红头文件，上面的内容大概是要求市政府的教育部门派遣几人和警察合力组成一支调查小队，前往古城福音中学调查近一段时间学生失踪的事情。",
      "clueIds": [
        "clue_001",
        "clue_002"
      ],
      "transitionCondition": "调查员接受任务，准备前往古城福音中学"
    },
    {
      "id": "scene_002",
      "name": "启程",
      "description": "调查员们会在古城福音中学门口会面，并一同进入古城福音中学调查。在学校门口，调查员可以看到学校的平面图。迎接调查员们的是学校保卫处的处长，然后他会将调查员们带领到校长马卡拉的办公室里。",
      "clueIds": [
        "clue_003",
        "clue_004"
      ],
      "transitionCondition": "调查员进入古城福音中学开始调查"
    },
    {
      "id": "scene_003",
      "name": "校长办公室",
      "description": "保卫处处长在将调查员带到校长办公室门口后，敲了敲门，将调查员们送进马卡拉的办公室后就离开了。调查员进入办公室之后会看到一位身穿神父黑袍的中年男子（马卡拉）坐在办公桌前，正埋着头写什么东西。看到调查员，马卡拉合上了本子，并请调查员坐在办公室里另一侧的茶几边。为调查员泡了茶之后，马卡拉也在茶几边坐下。",
      "npcIds": [
        "npc_001"
      ],
      "clueIds": [
        "clue_005",
        "clue_006",
        "clue_007",
        "clue_008"
      ],
      "transitionCondition": "调查员从马卡拉处获得基本信息或自行调查办公室"
    },
    {
      "id": "scene_004",
      "name": "教师办公室",
      "description": "调查员进入教师办公室之后会看到几名教师正在备课，坐在靠近门口的一位微微发福的中年女性站起来迎接调查员。她会询问调查员们他们的身份和来意。得知调查员来调查学生失踪事件的中年女性会激动地握住调查员的手，看起来很激动的样子。",
      "npcIds": [
        "npc_002",
        "npc_003"
      ],
      "clueIds": [
        "clue_009",
        "clue_010",
        "clue_011",
        "clue_012"
      ],
      "transitionCondition": "调查员从教师处获得更多信息"
    },
    {
      "id": "scene_005",
      "name": "总务办公室",
      "description": "总务办公室的门锁着，张明远正在整理仓库。调查员可以在总务办公室旁边的仓库见到张明远。",
      "npcIds": [
        "npc_004"
      ],
      "clueIds": [
        "clue_013",
        "clue_014",
        "clue_015",
        "clue_016"
      ],
      "transitionCondition": "调查员从张明远处获得信息或自行调查办公室"
    },
    {
      "id": "scene_006",
      "name": "教学楼1",
      "description": "这栋教学楼有五层，前四层每层都有6个教室和厕所，第五层是通向天台的门。调查员在从校长或者督学主任口中得知失踪学生所在的班级后，可以轻松地找到失踪学生的同学。",
      "clueIds": [
        "clue_017",
        "clue_018",
        "clue_019"
      ],
      "transitionCondition": "调查员从学生处获得信息或前往天台调查"
    },
    {
      "id": "scene_007",
      "name": "天台",
      "description": "天台上着锁，调查员需要通过开锁检定或力量检定开启这扇门。进入天台之后，调查员可以发现天台上堆放着大量的杂物。调查员走近这些杂物观察可以发现，这些废弃的桌椅、木板等物品围成了一个圈。",
      "clueIds": [
        "clue_020"
      ],
      "transitionCondition": "调查员发现天台上的异常"
    },
    {
      "id": "scene_008",
      "name": "教学楼2 & 图书馆",
      "description": "这是一栋两层高的建筑。一层为三个教室，门牌上分别写着一年级庚班到三年级庚班。这三个班级是马卡拉从贫困地区带来的学生组成的班级。二层是图书馆。",
      "clueIds": [
        "clue_021",
        "clue_022",
        "clue_023"
      ],
      "transitionCondition": "调查员从学生或图书馆获得信息"
    },
    {
      "id": "scene_009",
      "name": "学生宿舍",
      "description": "这是一栋三层高的建筑。整个建筑从中间分开，西边是女生宿舍，东边是男生宿舍，两侧不互通。如果调查员在下午六点跟踪着马卡拉来到宿舍附近，调查员可以看到他走进了男生宿舍。",
      "clueIds": [
        "clue_024",
        "clue_025",
        "clue_026"
      ],
      "transitionCondition": "调查员在宿舍获得信息或发现地下密室入口"
    },
    {
      "id": "scene_010",
      "name": "106宿舍",
      "description": "这间宿舍上着锁，通过开锁检定或从楼管处索要钥匙可以进入这间宿舍。调查员进入宿舍之后会闻到一股浓重的异味，像是混合在一起的腐臭味和霉味。",
      "clueIds": [
        "clue_027"
      ],
      "transitionCondition": "调查员发现地板下的通道"
    },
    {
      "id": "scene_011",
      "name": "地下密室",
      "description": "调查员走进地下之后会来到一个空旷的地下空间。那是一间由石头建造的地下室，隐隐传来水流声证实这里曾经是地下排水系统的一部分，整间地下室内充满了浓郁的恶臭味。",
      "clueIds": [
        "clue_028",
        "clue_029",
        "clue_030"
      ],
      "transitionCondition": "调查员在密室中发现关键线索或遭遇马卡拉"
    }
  ],
  "npcs": [
    {
      "id": "npc_001",
      "name": "杨·马卡拉",
      "description": "古城福音中学的出资人兼校长，同时也教授学生法语和宗教相关知识。作为天主教传教士在古城市活动。年纪不大但头发全白，随时穿着神父黑袍。本名为Yong Michèle。",
      "dialogueStyle": "表面上慈善和蔼，实则隐藏着邪恶信仰"
    },
    {
      "id": "npc_002",
      "name": "刘向圆",
      "description": "略微发福的中年女性，留着一头染成棕色的大波浪卷发。脖子上总是戴着一条鸡蛋大小的绿宝石吊坠。在双亲死于战争后，逃难到古城市的刘向圆追随自己母亲的道路，成为了古城福音中学的国语教师。刘向圆的教导方法和温柔的性格深受学生的喜爱，因此她成为了古城福音中学的督学主任。",
      "dialogueStyle": "温柔耐心，对学生关爱有加"
    },
    {
      "id": "npc_003",
      "name": "教师",
      "description": "古城福音中学的普通教师，对刘向圆和马卡拉的真实情况有所了解",
      "dialogueStyle": "对学校事务和人际关系有一定见解"
    },
    {
      "id": "npc_004",
      "name": "张明远",
      "description": "不到30岁的样子，身材瘦小的男性。喜欢戴草帽、抽旱烟，总是随身携带着眼袋和烟枪。凭借着出众的办事能力当上了古城市福音中学的总务处处长。平时负责学校的大大小小的杂物，从物资采购到校园修缮，除了教学之外的事务几乎都由他一手操办。",
      "dialogueStyle": "务实，对学校财务问题有所不满"
    },
    {
      "id": "npc_005",
      "name": "欧得",
      "description": "身材瘦小的法国人，留着一头金色卷发，年龄大约30岁。中文水平较差，基本上只能用中文进行最低限度的交流。欧得是杨·马卡拉的弟弟，曾经也是一名天主教信徒，为了阻止马卡拉的计划而来。",
      "dialogueStyle": "神秘，对马卡拉抱有深重仇恨"
    }
  ],
  "clues": [
    {
      "id": "clue_001",
      "description": "古城福音中学近期学生频繁失踪，已有12名学生失踪"
    },
    {
      "id": "clue_002",
      "description": "市长儿子是第12名失踪学生，政府和警察局合作调查此案"
    },
    {
      "id": "clue_003",
      "description": "学校平面图显示行政楼、教学楼和学生宿舍的布局"
    },
    {
      "id": "clue_004",
      "description": "马卡拉声称愿意配合调查，并表示学校有640名学生"
    },
    {
      "id": "clue_005",
      "description": "马卡拉办公桌上的咖啡杯杯底有白色粉末，疑似毒品"
    },
    {
      "id": "clue_006",
      "description": "马卡拉办公桌上缺少《圣经》，只有三本宗教书籍"
    },
    {
      "id": "clue_007",
      "description": "木盒内有咖啡粉，底部藏有写着卡塔尔地址的油纸包"
    },
    {
      "id": "clue_008",
      "description": "学校地基设计图显示学生宿舍下方有地下排水设施"
    },
    {
      "id": "clue_009",
      "description": "刘向圆称失踪学生都是好学生，学习成绩较好"
    },
    {
      "id": "clue_010",
      "description": "有一名学生在失踪前因身体不舒服请假，但并未回家"
    },
    {
      "id": "clue_011",
      "description": "教师间流传刘向圆是马卡拉私情人，借此快速晋升"
    },
    {
      "id": "clue_012",
      "description": "马卡拉很少管理学校事务，经常不在办公室"
    },
    {
      "id": "clue_013",
      "description": "学校近5个月预算突然增加，账目有伪造痕迹"
    },
    {
      "id": "clue_014",
      "description": "张明远日记中多次提到对现状的不满和无力"
    },
    {
      "id": "clue_015",
      "description": "学校曾在5个月前对男生宿舍进行过修缮"
    },
    {
      "id": "clue_016",
      "description": "男生宿舍106室钥匙丢失，天台钥匙也丢失"
    },
    {
      "id": "clue_017",
      "description": "失踪学生中有一名住校生，宿舍在106室"
    },
    {
      "id": "clue_018",
      "description": "有一名走读生失踪前请假，但家长称其并未回家"
    },
    {
      "id": "clue_019",
      "description": "学生称校长经学课后会私下传授天主教经典"
    },
    {
      "id": "clue_020",
      "description": "天台上堆放的杂物围成类似动物巢穴的形状"
    },
    {
      "id": "clue_021",
      "description": "马卡拉挑选贫困地区学生时使用奇怪的试题"
    },
    {
      "id": "clue_022",
      "description": "图书馆已关闭，但有人看到马卡拉从楼上下来"
    },
    {
      "id": "clue_023",
      "description": "图书馆书架上发现一本关于邪教的英文手抄本"
    },
    {
      "id": "clue_024",
      "description": "学生称晚上听到奇怪声音，有人看到黑影和巨大蝙蝠"
    },
    {
      "id": "clue_025",
      "description": "宿舍楼建筑在原定地下排水通道入口上"
    },
    {
      "id": "clue_026",
      "description": "宿舍106室地板下有进入地下排水系统的通道"
    },
    {
      "id": "clue_027",
      "description": "106宿舍内发现氧化发黑的血迹和腐臭味"
    },
    {
      "id": "clue_028",
      "description": "地下密室中央有血迹斑斑的石板，角落堆放残缺尸骨"
    },
    {
      "id": "clue_029",
      "description": "密室顶部刻有不详的魔法阵图案"
    },
    {
      "id": "clue_030",
      "description": "从尸骨衣物中发现一张失踪学生的请假条"
    }
  ],
  "checks": [
    {
      "id": "check_001",
      "skill": "侦查",
      "difficulty": "普通",
      "dc": 50,
      "successSceneId": "scene_003",
      "failSceneId": "scene_003"
    },
    {
      "id": "check_002",
      "skill": "医学/科学：药学/科学：化学",
      "difficulty": "普通",
      "dc": 50,
      "successSceneId": "scene_003",
      "failSceneId": "scene_003"
    },
    {
      "id": "check_003",
      "skill": "图书馆使用",
      "difficulty": "普通",
      "dc": 50,
      "successSceneId": "scene_003",
      "failSceneId": "scene_003"
    },
    {
      "id": "check_004",
      "skill": "语言：英语/语言：阿拉伯语",
      "difficulty": "普通",
      "dc": 50,
      "successSceneId": "scene_003",
      "failSceneId": "scene_003"
    },
    {
      "id": "check_005",
      "skill": "开锁",
      "difficulty": "普通",
      "dc": 50,
      "successSceneId": "scene_007",
      "failSceneId": "scene_007"
    },
    {
      "id": "check_006",
      "skill": "追踪",
      "difficulty": "普通",
      "dc": 50,
      "successSceneId": "scene_010",
      "failSceneId": "scene_010"
    },
    {
      "id": "check_007",
      "skill": "人类学",
      "difficulty": "普通",
      "dc": 50,
      "successSceneId": "scene_009",
      "failSceneId": "scene_009"
    }
  ]
}